{
  "version": "1.0",
  "distribution": {
    "1_monitor": {
      "primary": [1, 2, 3, 4, 5, 6, 7, 8, 9, 10],
      "secondary": [],
      "tertiary": []
    },
    "2_monitors": {
      "primary": [1, 2],
      "secondary": [3, 4, 5, 6, 7, 8, 9, 10],
      "tertiary": []
    },
    "3_monitors": {
      "primary": [1, 2],
      "secondary": [3, 4, 5],
      "tertiary": [6, 7, 8, 9, 10]
    }
  },
  "workspace_preferences": {},
  "output_preferences": {},
  "debounce_ms": 1000,
  "enable_auto_reassign": true
}
